{
  "replay": { "name": "title-to-gameplay" },
  "frames": 900,
  "swap": [{ "at": 300, "mod": "conflict-b-js" }],
  "expect": [
    { "kind": "no_trap" },
    { "kind": "symbol", "at": 300, "symbol": "gRandomState", "type": "u32", "op": ">=", "value": 2684354560 },
    { "kind": "symbol", "at": 300, "symbol": "gRandomState", "type": "u32", "op": "<", "value": 2952790016 },
    { "kind": "symbol", "at": 900, "symbol": "gRandomState", "type": "u32", "op": ">=", "value": 2952790016 },
    { "kind": "symbol", "at": 900, "symbol": "gRandomState", "type": "u32", "op": "<", "value": 3221225472 }
  ]
}
